user,Hey Mags,2023-04-27T00:45:37.293Z
system,"Charmeleon: Charmeleon! What's up, Maggie? How can I assist you today?",2023-04-27T00:45:39.484Z
user,I want you to remember my favorite color is Green.,2023-04-27T00:45:45.784Z
system,"Charmeleon: Charmeleon! Got it, Maggie! Your favorite color is green. Is there anything else you'd like me to remember or assist you with?",2023-04-27T00:45:48.947Z
user,that is going to be it for now. thanks,2023-04-27T00:45:56.103Z
system,"Charmeleon: Charmeleon! You're welcome, Maggie! Don't hesitate to reach out if you need anything else. Have a great day!",2023-04-27T00:45:59.395Z
user,Hey Mags! Recall my favorite color for me.,2023-04-27T00:46:43.294Z
system,"Charmeleon: Charmeleon! Hey there, Maggie! Your favorite color is green. Is there anything else I can help you with?",2023-04-27T00:46:46.081Z
